{"artifact_version": "hill_climb.v3", "change_summary": "Relax the calm hazard/flow thresholds slightly while softening the decay coefficient to test whether the near-miss variant was simply over-gated.", "created_at": "2026-04-09T00:11:52+00:00", "delta_vs_incumbent": -0.025193906436868474, "description": "Slightly widen the calm thresholds for post-recenter divergence relief and trim the decay strength.", "eval_id": "screen_0004", "hypothesis_id": "h001-quiet-divergence-relaxation", "incumbent_before": {"artifact_version": "hill_climb.v3", "change_summary": null, "created_at": "2026-04-08T23:55:55+00:00", "delta_vs_incumbent": null, "description": "Fresh retained screen baseline from the current quiet-latent-recentering live source.", "eval_id": "screen_0001", "hypothesis_id": null, "incumbent_before": null, "label": "live-baseline", "mean_edge": 434.3012020112816, "parent_eval_id": null, "parent_source_sha256": null, "replay_reason": null, "research_refs": [], "run_id": "apr08-screen430-1654", "scorecard": {"by_slice": {"mean_edge_deciles": {"d01": {"arb_edge": -80.50415372232499, "arb_flow_share": 0.31417313002756153, "arb_loss_share": 0.16054385609310864, "arb_loss_to_retail_gain": 0.19124746094051512, "arb_to_retail_volume_ratio": 0.45809393563157896, "arb_trade_count": 2882.5, "benchmark_mean_edge": 328.4103067748207, "edge_stddev": 17.769867828029383, "max_edge": 353.1574142749011, "max_fee_jump": 0.019380579342809574, "mean_edge": 340.43818625135293, "mean_edge_delta": 12.027879476532263, "min_edge": 310.16790821615655, "retail_edge": 420.9423399736778, "retail_flow_share": 0.6858268699724385, "retail_gain_share": 0.8394561439068914, "retail_trade_count": 5001.25, "retail_volume_share": 0.42782390411143145, "simulation_count": 4, "time_weighted_ask_fee": 0.003930297792347457, "time_weighted_bid_fee": 0.004002423807055908}, "d02": {"arb_edge": -99.5521444679678, "arb_flow_share": 0.3110143965109089, "arb_loss_share": 0.17549334971341898, "arb_loss_to_retail_gain": 0.21284649390325866, "arb_to_retail_volume_ratio": 0.45140913675975414, "arb_trade_count": 2944.3333333333335, "benchmark_mean_edge": 338.92050403785925, "edge_stddev": 3.0122274144781644, "max_edge": 370.6435963323888, "max_fee_jump": 0.025682338475091524, "mean_edge": 368.1658932706072, "mean_edge_delta": 29.245389232747964, "min_edge": 363.92603996563673, "retail_edge": 467.71803773857545, "retail_flow_share": 0.6889856034890911, "retail_gain_share": 0.824506650286581, "retail_trade_count": 5448.0, "retail_volume_share": 0.4389753754858494, "simulation_count": 3, "time_weighted_ask_fee": 0.003864177576862745, "time_weighted_bid_fee": 0.003795210382972692}, "d03": {"arb_edge": -98.8390327987402, "arb_flow_share": 0.3129178788662098, "arb_loss_share": 0.16979269097956437, "arb_loss_to_retail_gain": 0.20451842465697312, "arb_to_retail_volume_ratio": 0.4554300996070857, "arb_trade_count": 3004.0, "benchmark_mean_edge": 361.67912737974297, "edge_stddev": 2.9633713051532853, "max_edge": 387.63284799866767, "max_fee_jump": 0.017777511414374978, "mean_edge": 384.43787960911396, "mean_edge_delta": 22.758752229371055, "min_edge": 380.4916751286021, "retail_edge": 483.2769124078536, "retail_flow_share": 0.6870821211337902, "retail_gain_share": 0.8302073090204357, "retail_trade_count": 5577.0, "retail_volume_share": 0.4362719656746214, "simulation_count": 3, "time_weighted_ask_fee": 0.003857236583088992, "time_weighted_bid_fee": 0.0038523158989210537}, "d04": {"arb_edge": -109.6555545861771, "arb_flow_share": 0.3107500740539567, "arb_loss_share": 0.1784094026412791, "arb_loss_to_retail_gain": 0.21715122253691324, "arb_to_retail_volume_ratio": 0.45085253165233313, "arb_trade_count": 2966.3333333333335, "benchmark_mean_edge": 360.77390571428214, "edge_stddev": 2.6574970180959743, "max_edge": 397.4479372288037, "max_fee_jump": 0.0268209177369165, "mean_edge": 395.31767699457896, "mean_edge_delta": 34.543771280296845, "min_edge": 391.57114256206694, "retail_edge": 504.9732315807566, "retail_flow_share": 0.6892499259460432, "retail_gain_share": 0.821590597358721, "retail_trade_count": 5568.0, "retail_volume_share": 0.4367803805242097, "simulation_count": 3, "time_weighted_ask_fee": 0.0038379295475556544, "time_weighted_bid_fee": 0.00389524391943865}, "d05": {"arb_edge": -127.03914252319123, "arb_flow_share": 0.3197796145535342, "arb_loss_share": 0.1920523373046954, "arb_loss_to_retail_gain": 0.23770393327707748, "arb_to_retail_volume_ratio": 0.47011177758756134, "arb_trade_count": 3026.6666666666665, "benchmark_mean_edge": 357.40426134028854, "edge_stddev": 5.6221711235034615, "max_edge": 414.89627990134596, "max_fee_jump": 0.03403310603863412, "mean_edge": 407.4036021625231, "mean_edge_delta": 49.99934082223456, "min_edge": 401.3533432772375, "retail_edge": 534.4427446857145, "retail_flow_share": 0.6802203854464658, "retail_gain_share": 0.8079476626953046, "retail_trade_count": 5453.0, "retail_volume_share": 0.436113347922034, "simulation_count": 3, "time_weighted_ask_fee": 0.0038258361970587517, "time_weighted_bid_fee": 0.0038641545068422295}, "d06": {"arb_edge": -120.88658826272167, "arb_flow_share": 0.31234732565032897, "arb_loss_share": 0.17997180011107008, "arb_loss_to_retail_gain": 0.21947025740754608, "arb_to_retail_volume_ratio": 0.4542225127615813, "arb_trade_count": 3195.75, "benchmark_mean_edge": 390.5687788090306, "edge_stddev": 3.5003077847271657, "max_edge": 433.96659499150036, "max_fee_jump": 0.02302471356664067, "mean_edge": 429.92421266617555, "mean_edge_delta": 39.355433857144874, "min_edge": 424.4718038944109, "retail_edge": 550.8108009288972, "retail_flow_share": 0.687652674349671, "retail_gain_share": 0.8200281998889298, "retail_trade_count": 6101.5, "retail_volume_share": 0.4380430186205595, "simulation_count": 4, "time_weighted_ask_fee": 0.003917131043017189, "time_weighted_bid_fee": 0.0038149758602342284}, "d07": {"arb_edge": -107.22624214868385, "arb_flow_share": 0.3012368702703591, "arb_loss_share": 0.15921489627717897, "arb_loss_to_retail_gain": 0.1893645541199631, "arb_to_retail_volume_ratio": 0.43110012170635126, "arb_trade_count": 3270.0, "benchmark_mean_edge": 432.1806686329355, "edge_stddev": 3.800481879698164, "max_edge": 463.86346242458205, "max_fee_jump": 0.017961860605094585, "mean_edge": 459.01617131141785, "mean_edge_delta": 26.83550267848231, "min_edge": 454.5817248136557, "retail_edge": 566.2424134601011, "retail_flow_share": 0.6987631297296408, "retail_gain_share": 0.8407851037228211, "retail_trade_count": 6892.0, "retail_volume_share": 0.44125652701362317, "simulation_count": 3, "time_weighted_ask_fee": 0.003653325086093914, "time_weighted_bid_fee": 0.003880972831300226}, "d08": {"arb_edge": -149.7083177453978, "arb_flow_share": 0.2948997372881786, "arb_loss_share": 0.18803853740860144, "arb_loss_to_retail_gain": 0.23158554447703833, "arb_to_retail_volume_ratio": 0.4182380193052146, "arb_trade_count": 3158.3333333333335, "benchmark_mean_edge": 433.80729426835114, "edge_stddev": 3.3063242592128286, "max_edge": 500.1105295605183, "max_fee_jump": 0.037744485353358316, "mean_edge": 496.7410022389998, "mean_edge_delta": 62.9337079706487, "min_edge": 492.2486801402478, "retail_edge": 646.4493199843972, "retail_flow_share": 0.7051002627118214, "retail_gain_share": 0.8119614625913986, "retail_trade_count": 6979.0, "retail_volume_share": 0.4414719277115012, "simulation_count": 3, "time_weighted_ask_fee": 0.0038972105475848346, "time_weighted_bid_fee": 0.003763878863055025}, "d09": {"arb_edge": -148.95064959687195, "arb_flow_share": 0.30392131328778105, "arb_loss_share": 0.1784191102170895, "arb_loss_to_retail_gain": 0.21716560406393323, "arb_to_retail_volume_ratio": 0.4366191913205809, "arb_trade_count": 3462.6666666666665, "benchmark_mean_edge": 472.7253067840316, "edge_stddev": 1.2299810784836924, "max_edge": 538.6085481642161, "max_fee_jump": 0.025963841629706535, "mean_edge": 536.9344390611874, "mean_edge_delta": 64.20913227715583, "min_edge": 535.6883622443754, "retail_edge": 685.8850886580598, "retail_flow_share": 0.696078686712219, "retail_gain_share": 0.8215808897829106, "retail_trade_count": 7365.666666666667, "retail_volume_share": 0.4472357554884218, "simulation_count": 3, "time_weighted_ask_fee": 0.003755779517958928, "time_weighted_bid_fee": 0.0038066731381127474}, "d10": {"arb_edge": -170.91066300046248, "arb_flow_share": 0.3010190731868928, "arb_loss_share": 0.19006948649946828, "arb_loss_to_retail_gain": 0.2346738187180838, "arb_to_retail_volume_ratio": 0.43065420190983117, "arb_trade_count": 3404.0, "benchmark_mean_edge": 481.6015533235047, "edge_stddev": 13.684020666210063, "max_edge": 576.6544789715836, "max_fee_jump": 0.030761746607862697, "mean_edge": 557.3796249152037, "mean_edge_delta": 75.77807159169907, "min_edge": 546.2459916115156, "retail_edge": 728.2902879156678, "retail_flow_share": 0.6989809268131072, "retail_gain_share": 0.8099305135005317, "retail_trade_count": 7628.0, "retail_volume_share": 0.44798002874811826, "simulation_count": 3, "time_weighted_ask_fee": 0.00376320814077657, "time_weighted_bid_fee": 0.003793165525125828}}, "retail_intensity_terciles": {"high": {"arb_edge": -142.4725580559844, "arb_flow_share": 0.299673781954498, "arb_loss_share": 0.17692224844423832, "arb_loss_to_retail_gain": 0.21495204810216795, "arb_to_retail_volume_ratio": 0.42790598757082005, "arb_trade_count": 3377.3, "benchmark_mean_edge": 465.5334862912373, "edge_stddev": 36.63830067579513, "max_edge": 576.6544789715836, "max_fee_jump": 0.024428452066324106, "mean_edge": 520.3383307626523, "mean_edge_delta": 54.80484447141505, "min_edge": 458.6033266960158, "retail_edge": 662.8108888186372, "retail_flow_share": 0.700326218045502, "retail_gain_share": 0.8230777515557616, "retail_trade_count": 7417.1, "retail_volume_share": 0.4454041148472961, "simulation_count": 10, "time_weighted_ask_fee": 0.0037509378600420274, "time_weighted_bid_fee": 0.0038021296949374028}, "low": {"arb_edge": -103.14634263649818, "arb_flow_share": 0.31627575963014093, "arb_loss_share": 0.17862071692932685, "arb_loss_to_retail_gain": 0.21746435612737258, "arb_to_retail_volume_ratio": 0.46257795315118905, "arb_trade_count": 2921.4545454545455, "benchmark_mean_edge": 339.5471937960083, "edge_stddev": 28.722362243502737, "max_edge": 414.89627990134596, "max_fee_jump": 0.026311436860720995, "mean_edge": 371.16744594632405, "mean_edge_delta": 31.620252150315753, "min_edge": 310.16790821615655, "retail_edge": 474.31378858282227, "retail_flow_share": 0.683724240369859, "retail_gain_share": 0.8213792830706731, "retail_trade_count": 5186.0, "retail_volume_share": 0.43415428851469706, "simulation_count": 11, "time_weighted_ask_fee": 0.0038877851358208437, "time_weighted_bid_fee": 0.0038995892788925217}, "mid": {"arb_edge": -116.53389627103091, "arb_flow_share": 0.3092742183182809, "arb_loss_share": 0.17865427992163538, "arb_loss_to_retail_gain": 0.21751410588051762, "arb_to_retail_volume_ratio": 0.44775253294482054, "arb_trade_count": 3101.181818181818, "benchmark_mean_edge": 382.07638291908444, "edge_stddev": 33.6526003654593, "max_edge": 492.2486801402478, "max_fee_jump": 0.026013479008158792, "mean_edge": 419.2193864840838, "mean_edge_delta": 37.14300356499944, "min_edge": 369.928043513796, "retail_edge": 535.7532827551147, "retail_flow_share": 0.6907257816817192, "retail_gain_share": 0.8213457200783646, "retail_trade_count": 5993.272727272727, "retail_volume_share": 0.43769038708095653, "simulation_count": 11, "time_weighted_ask_fee": 0.0038617099852682, "time_weighted_bid_fee": 0.0038461513499340127}}, "volatility_terciles": {"high": {"arb_edge": -118.95127168885669, "arb_flow_share": 0.3102848213403929, "arb_loss_share": 0.1776603907897308, "arb_loss_to_retail_gain": 0.21604260429623023, "arb_to_retail_volume_ratio": 0.44987384784455614, "arb_trade_count": 3148.6, "benchmark_mean_edge": 393.2695935168987, "edge_stddev": 65.75183049255942, "max_edge": 549.2384041625121, "max_fee_jump": 0.026519133114481463, "mean_edge": 431.6404603278277, "mean_edge_delta": 38.370866810928995, "min_edge": 345.27768290338304, "retail_edge": 550.5917320166849, "retail_flow_share": 0.6897151786596071, "retail_gain_share": 0.8223396092102693, "retail_trade_count": 6096.8, "retail_volume_share": 0.43797767979474794, "simulation_count": 10, "time_weighted_ask_fee": 0.003863694352762902, "time_weighted_bid_fee": 0.0038854074925956062}, "low": {"arb_edge": -113.94154598628676, "arb_flow_share": 0.3067615244272048, "arb_loss_share": 0.1771893481413077, "arb_loss_to_retail_gain": 0.2153464442165946, "arb_to_retail_volume_ratio": 0.44250504730531576, "arb_trade_count": 3046.7272727272725, "benchmark_mean_edge": 376.2934978642974, "edge_stddev": 59.59404649252687, "max_edge": 500.1105295605183, "max_fee_jump": 0.025578895085346408, "mean_edge": 415.1665449357291, "mean_edge_delta": 38.87304707143168, "min_edge": 310.16790821615655, "retail_edge": 529.1080909220159, "retail_flow_share": 0.6932384755727953, "retail_gain_share": 0.8228106518586923, "retail_trade_count": 5963.454545454545, "retail_volume_share": 0.4395692034046919, "simulation_count": 11, "time_weighted_ask_fee": 0.0038488873705610684, "time_weighted_bid_fee": 0.0038075511576076376}, "mid": {"arb_edge": -127.12168052772205, "arb_flow_share": 0.30638181234702033, "arb_loss_share": 0.17901989145604966, "arb_loss_to_retail_gain": 0.21805630805544182, "arb_to_retail_volume_ratio": 0.4417153670432652, "arb_trade_count": 3183.818181818182, "benchmark_mean_edge": 411.0245268274667, "edge_stddev": 76.16907510499821, "max_edge": 576.6544789715836, "max_fee_jump": 0.024845401648844877, "mean_edge": 455.8547151627012, "mean_edge_delta": 44.83018833523447, "min_edge": 353.14973961097104, "retail_edge": 582.9763956904231, "retail_flow_share": 0.6936181876529798, "retail_gain_share": 0.8209801085439502, "retail_trade_count": 6416.090909090909, "retail_volume_share": 0.4408748369133192, "simulation_count": 11, "time_weighted_ask_fee": 0.0037981018480544517, "time_weighted_bid_fee": 0.0038624823824387113}}}, "gate": {"failures": [], "passed": true, "required_metric_fields": ["mean_edge"], "stage": "screen", "thresholds": {"mean_edge": 0.0}}, "overall": {"arb_edge": -120.03775651695824, "arb_flow_share": 0.30772375088114534, "arb_loss_share": 0.1779980741311821, "arb_loss_to_retail_gain": 0.21654216192139256, "arb_to_retail_volume_ratio": 0.44451005111445513, "arb_trade_count": 3125.6875, "benchmark_mean_edge": 393.5373189618248, "edge_stddev": 69.67028803300772, "max_edge": 576.6544789715836, "max_fee_jump": 0.02562058110065371, "mean_edge": 434.3012020112816, "mean_edge_delta": 40.763883049456794, "min_edge": 310.16790821615655, "retail_edge": 554.3389585282399, "retail_flow_share": 0.6922762491188547, "retail_gain_share": 0.8220019258688179, "retail_trade_count": 6160.71875, "retail_volume_share": 0.43954195860847356, "simulation_count": 32, "time_weighted_ask_fee": 0.0038360570291374923, "time_weighted_bid_fee": 0.0038507638708270594}, "run_metadata": {"seed_block": [0, 1, 2, 3, 4, 5, 6, 7, 8, 9, 10, 11, 12, 13, 14, 15, 16, 17, 18, 19, 20, 21, 22, 23, 24, 25, 26, 27, 28, 29, 30, 31], "seeds": [0, 1, 2, 3, 4, 5, 6, 7, 8, 9, 10, 11, 12, 13, 14, 15, 16, 17, 18, 19, 20, 21, 22, 23, 24, 25, 26, 27, 28, 29, 30, 31], "simulation_count": 32, "stage": "screen", "telemetry_version": "1.1"}, "scorecard_version": "1.2"}, "selection": {"promotion_margin": null, "rationale": "no incumbent for this stage"}, "snapshot_path": "artifacts/hill_climb/apr08-screen430-1654/snapshots/8af1aa3d1ecb65a442be50cf347044f2be9212eb9bde2e28a757846580bb1de4.sol", "snapshot_relpath": "snapshots/8af1aa3d1ecb65a442be50cf347044f2be9212eb9bde2e28a757846580bb1de4.sol", "source_path": "/Users/victorqian/Desktop/opt_arena/simple_amm/contracts/src/Strategy.sol", "source_sha256": "8af1aa3d1ecb65a442be50cf347044f2be9212eb9bde2e28a757846580bb1de4", "stage": "screen", "stage_description": "Fast mean-edge screening on canonical screening seeds.", "status": "seed", "strategy_name": "LatentStateQuoteEngine"}, "label": "quiet-divergence-relax-longgap-v3", "mean_edge": 434.2760081048447, "parent_eval_id": "screen_0003", "parent_source_sha256": "0120d719c9844e6f884fafacdbdbc0d41494cb65211bf8b8fc6fb01fa08a50a2", "replay_reason": null, "research_refs": ["docs/plans/active/apr08-screen430-1654.md", "https://app.uniswap.org/whitepaper-v4.pdf", "https://www.math.columbia.edu/~mnutz/docs/AMM_fees.pdf"], "run_id": "apr08-screen430-1654", "scorecard": {"by_slice": {"mean_edge_deciles": {"d01": {"arb_edge": -80.50767104771785, "arb_flow_share": 0.3141777096170945, "arb_loss_share": 0.16054926652001955, "arb_loss_to_retail_gain": 0.191255138767293, "arb_to_retail_volume_ratio": 0.45810367207762254, "arb_trade_count": 2882.5, "benchmark_mean_edge": 328.40515970899446, "edge_stddev": 17.76852589245688, "max_edge": 353.15301244288764, "max_fee_jump": 0.01938059617047197, "mean_edge": 340.43616118925195, "mean_edge_delta": 12.031001480257473, "min_edge": 310.16804657772605, "retail_edge": 420.94383223697025, "retail_flow_share": 0.6858222903829054, "retail_gain_share": 0.8394507334799804, "retail_trade_count": 5001.25, "retail_volume_share": 0.4278331901783515, "simulation_count": 4, "time_weighted_ask_fee": 0.003930191156839152, "time_weighted_bid_fee": 0.00400230888331877}, "d02": {"arb_edge": -99.5533396596494, "arb_flow_share": 0.3110158907099968, "arb_loss_share": 0.17549505170152435, "arb_loss_to_retail_gain": 0.21284899752717323, "arb_to_retail_volume_ratio": 0.4514122844291694, "arb_trade_count": 2944.3333333333335, "benchmark_mean_edge": 338.9188866661311, "edge_stddev": 3.0126099105469213, "max_edge": 370.642615832256, "max_fee_jump": 0.02568231939107425, "mean_edge": 368.16481178214894, "mean_edge_delta": 29.245925116017833, "min_edge": 363.9243946352539, "retail_edge": 467.71815144179845, "retail_flow_share": 0.6889841092900031, "retail_gain_share": 0.8245049482984756, "retail_trade_count": 5448.0, "retail_volume_share": 0.43897807511742204, "simulation_count": 3, "time_weighted_ask_fee": 0.003864145542468353, "time_weighted_bid_fee": 0.0037951778520218422}, "d03": {"arb_edge": -98.84239058190651, "arb_flow_share": 0.31291943005545264, "arb_loss_share": 0.16980045783424727, "arb_loss_to_retail_gain": 0.20452969341718322, "arb_to_retail_volume_ratio": 0.45543338546265044, "arb_trade_count": 3002.6666666666665, "benchmark_mean_edge": 361.679040596199, "edge_stddev": 2.979115508388455, "max_edge": 387.630428535078, "max_fee_jump": 0.01777750453803177, "mean_edge": 384.4243123133833, "mean_edge_delta": 22.74527171718434, "min_edge": 380.45412347141433, "retail_edge": 483.2667028952894, "retail_flow_share": 0.6870805699445475, "retail_gain_share": 0.8301995421657526, "retail_trade_count": 5577.666666666667, "retail_volume_share": 0.4362685432934557, "simulation_count": 3, "time_weighted_ask_fee": 0.0038572908641703457, "time_weighted_bid_fee": 0.0038527569138886546}, "d04": {"arb_edge": -109.74662996517533, "arb_flow_share": 0.31076144761376323, "arb_loss_share": 0.17856364734650368, "arb_loss_to_retail_gain": 0.21737977235812278, "arb_to_retail_volume_ratio": 0.4508764730844861, "arb_trade_count": 2969.3333333333335, "benchmark_mean_edge": 360.6861252874001, "edge_stddev": 2.50747206305897, "max_edge": 396.93283210606194, "max_fee_jump": 0.02682090214585142, "mean_edge": 395.1146493279745, "mean_edge_delta": 34.42852404057434, "min_edge": 391.56893457568157, "retail_edge": 504.8612792931488, "retail_flow_share": 0.6892385523862367, "retail_gain_share": 0.8214363526534962, "retail_trade_count": 5569.666666666667, "retail_volume_share": 0.4369281668262812, "simulation_count": 3, "time_weighted_ask_fee": 0.0038363438870767795, "time_weighted_bid_fee": 0.0038931339974454006}, "d05": {"arb_edge": -127.0651261555147, "arb_flow_share": 0.319791669905266, "arb_loss_share": 0.1920875246384221, "arb_loss_to_retail_gain": 0.23775783948930126, "arb_to_retail_volume_ratio": 0.4701378324207348, "arb_trade_count": 3026.0, "benchmark_mean_edge": 357.41541419600367, "edge_stddev": 5.637491432998107, "max_edge": 414.86471726530164, "max_fee_jump": 0.03403324610701252, "mean_edge": 407.3657318487803, "mean_edge_delta": 49.95031765277662, "min_edge": 401.2719102860731, "retail_edge": 534.4308580042949, "retail_flow_share": 0.680208330094734, "retail_gain_share": 0.807912475361578, "retail_trade_count": 5453.0, "retail_volume_share": 0.4360931577665903, "simulation_count": 3, "time_weighted_ask_fee": 0.003825735125930433, "time_weighted_bid_fee": 0.0038641675779823386}, "d06": {"arb_edge": -120.88935106862652, "arb_flow_share": 0.3123488279449067, "arb_loss_share": 0.17997506690200835, "arb_loss_to_retail_gain": 0.2194751154968865, "arb_to_retail_volume_ratio": 0.4542256897656853, "arb_trade_count": 3195.75, "benchmark_mean_edge": 390.5655476359659, "edge_stddev": 3.499288494416865, "max_edge": 433.96556124372944, "max_fee_jump": 0.02302471705730745, "mean_edge": 429.92184588614407, "mean_edge_delta": 39.356298250178185, "min_edge": 424.47143875201095, "retail_edge": 550.8111969547704, "retail_flow_share": 0.6876511720550933, "retail_gain_share": 0.8200249330979916, "retail_trade_count": 6101.5, "retail_volume_share": 0.4380476739275534, "simulation_count": 4, "time_weighted_ask_fee": 0.003917082517183322, "time_weighted_bid_fee": 0.0038149257551754073}, "d07": {"arb_edge": -107.22727038945057, "arb_flow_share": 0.3012376584604217, "arb_loss_share": 0.1592161497261207, "arb_loss_to_retail_gain": 0.18936632723649152, "arb_to_retail_volume_ratio": 0.43110173595890533, "arb_trade_count": 3270.0, "benchmark_mean_edge": 432.1783753216113, "edge_stddev": 3.8007520970074227, "max_edge": 463.8623961617981, "max_fee_jump": 0.017961822121198043, "mean_edge": 459.0152710077801, "mean_edge_delta": 26.836895686168834, "min_edge": 454.5798416209837, "retail_edge": 566.2425413972306, "retail_flow_share": 0.6987623415395783, "retail_gain_share": 0.8407838502738793, "retail_trade_co