{"artifact_version": "hill_climb.v3", "change_summary": "Add a 3-5 bps shared-spread step-down only when gap, quietGate, hazard, flow, and spot-jump all indicate a very calm normal regime.", "created_at": "2026-04-09T00:22:09+00:00", "delta_vs_incumbent": -0.03288837616122464, "description": "Apply a tiny direct fee step-down only after long, already-quiet states.", "eval_id": "screen_0005", "hypothesis_id": "h002-threshold-calm-step", "incumbent_before": {"artifact_version": "hill_climb.v3", "change_summary": null, "created_at": "2026-04-08T23:55:55+00:00", "delta_vs_incumbent": null, "description": "Fresh retained screen baseline from the current quiet-latent-recentering live source.", "eval_id": "screen_0001", "hypothesis_id": null, "incumbent_before": null, "label": "live-baseline", "mean_edge": 434.3012020112816, "parent_eval_id": null, "parent_source_sha256": null, "replay_reason": null, "research_refs": [], "run_id": "apr08-screen430-1654", "scorecard": {"by_slice": {"mean_edge_deciles": {"d01": {"arb_edge": -80.50415372232499, "arb_flow_share": 0.31417313002756153, "arb_loss_share": 0.16054385609310864, "arb_loss_to_retail_gain": 0.19124746094051512, "arb_to_retail_volume_ratio": 0.45809393563157896, "arb_trade_count": 2882.5, "benchmark_mean_edge": 328.4103067748207, "edge_stddev": 17.769867828029383, "max_edge": 353.1574142749011, "max_fee_jump": 0.019380579342809574, "mean_edge": 340.43818625135293, "mean_edge_delta": 12.027879476532263, "min_edge": 310.16790821615655, "retail_edge": 420.9423399736778, "retail_flow_share": 0.6858268699724385, "retail_gain_share": 0.8394561439068914, "retail_trade_count": 5001.25, "retail_volume_share": 0.42782390411143145, "simulation_count": 4, "time_weighted_ask_fee": 0.003930297792347457, "time_weighted_bid_fee": 0.004002423807055908}, "d02": {"arb_edge": -99.5521444679678, "arb_flow_share": 0.3110143965109089, "arb_loss_share": 0.17549334971341898, "arb_loss_to_retail_gain": 0.21284649390325866, "arb_to_retail_volume_ratio": 0.45140913675975414, "arb_trade_count": 2944.3333333333335, "benchmark_mean_edge": 338.92050403785925, "edge_stddev": 3.0122274144781644, "max_edge": 370.6435963323888, "max_fee_jump": 0.025682338475091524, "mean_edge": 368.1658932706072, "mean_edge_delta": 29.245389232747964, "min_edge": 363.92603996563673, "retail_edge": 467.71803773857545, "retail_flow_share": 0.6889856034890911, "retail_gain_share": 0.824506650286581, "retail_trade_count": 5448.0, "retail_volume_share": 0.4389753754858494, "simulation_count": 3, "time_weighted_ask_fee": 0.003864177576862745, "time_weighted_bid_fee": 0.003795210382972692}, "d03": {"arb_edge": -98.8390327987402, "arb_flow_share": 0.3129178788662098, "arb_loss_share": 0.16979269097956437, "arb_loss_to_retail_gain": 0.20451842465697312, "arb_to_retail_volume_ratio": 0.4554300996070857, "arb_trade_count": 3004.0, "benchmark_mean_edge": 361.67912737974297, "edge_stddev": 2.9633713051532853, "max_edge": 387.63284799866767, "max_fee_jump": 0.017777511414374978, "mean_edge": 384.43787960911396, "mean_edge_delta": 22.758752229371055, "min_edge": 380.4916751286021, "retail_edge": 483.2769124078536, "retail_flow_share": 0.6870821211337902, "retail_gain_share": 0.8302073090204357, "retail_trade_count": 5577.0, "retail_volume_share": 0.4362719656746214, "simulation_count": 3, "time_weighted_ask_fee": 0.003857236583088992, "time_weighted_bid_fee": 0.0038523158989210537}, "d04": {"arb_edge": -109.6555545861771, "arb_flow_share": 0.3107500740539567, "arb_loss_share": 0.1784094026412791, "arb_loss_to_retail_gain": 0.21715122253691324, "arb_to_retail_volume_ratio": 0.45085253165233313, "arb_trade_count": 2966.3333333333335, "benchmark_mean_edge": 360.77390571428214, "edge_stddev": 2.6574970180959743, "max_edge": 397.4479372288037, "max_fee_jump": 0.0268209177369165, "mean_edge": 395.31767699457896, "mean_edge_delta": 34.543771280296845, "min_edge": 391.57114256206694, "retail_edge": 504.9732315807566, "retail_flow_share": 0.6892499259460432, "retail_gain_share": 0.821590597358721, "retail_trade_count": 5568.0, "retail_volume_share": 0.4367803805242097, "simulation_count": 3, "time_weighted_ask_fee": 0.0038379295475556544, "time_weighted_bid_fee": 0.00389524391943865}, "d05": {"arb_edge": -127.03914252319123, "arb_flow_share": 0.3197796145535342, "arb_loss_share": 0.1920523373046954, "arb_loss_to_retail_gain": 0.23770393327707748, "arb_to_retail_volume_ratio": 0.47011177758756134, "arb_trade_count": 3026.6666666666665, "benchmark_mean_edge": 357.40426134028854, "edge_stddev": 5.6221711235034615, "max_edge": 414.89627990134596, "max_fee_jump": 0.03403310603863412, "mean_edge": 407.4036021625231, "mean_edge_delta": 49.99934082223456, "min_edge": 401.3533432772375, "retail_edge": 534.4427446857145, "retail_flow_share": 0.6802203854464658, "retail_gain_share": 0.8079476626953046, "retail_trade_count": 5453.0, "retail_volume_share": 0.436113347922034, "simulation_count": 3, "time_weighted_ask_fee": 0.0038258361970587517, "time_weighted_bid_fee": 0.0038641545068422295}, "d06": {"arb_edge": -120.88658826272167, "arb_flow_share": 0.31234732565032897, "arb_loss_share": 0.17997180011107008, "arb_loss_to_retail_gain": 0.21947025740754608, "arb_to_retail_volume_ratio": 0.4542225127615813, "arb_trade_count": 3195.75, "benchmark_mean_edge": 390.5687788090306, "edge_stddev": 3.5003077847271657, "max_edge": 433.96659499150036, "max_fee_jump": 0.02302471356664067, "mean_edge": 429.92421266617555, "mean_edge_delta": 39.355433857144874, "min_edge": 424.4718038944109, "retail_edge": 550.8108009288972, "retail_flow_share": 0.687652674349671, "retail_gain_share": 0.8200281998889298, "retail_trade_count": 6101.5, "retail_volume_share": 0.4380430186205595, "simulation_count": 4, "time_weighted_ask_fee": 0.003917131043017189, "time_weighted_bid_fee": 0.0038149758602342284}, "d07": {"arb_edge": -107.22624214868385, "arb_flow_share": 0.3012368702703591, "arb_loss_share": 0.15921489627717897, "arb_loss_to_retail_gain": 0.1893645541199631, "arb_to_retail_volume_ratio": 0.43110012170635126, "arb_trade_count": 3270.0, "benchmark_mean_edge": 432.1806686329355, "edge_stddev": 3.800481879698164, "max_edge": 463.86346242458205, "max_fee_jump": 0.017961860605094585, "mean_edge": 459.01617131141785, "mean_edge_delta": 26.83550267848231, "min_edge": 454.5817248136557, "retail_edge": 566.2424134601011, "retail_flow_share": 0.6987631297296408, "retail_gain_share": 0.8407851037228211, "retail_trade_count": 6892.0, "retail_volume_share": 0.44125652701362317, "simulation_count": 3, "time_weighted_ask_fee": 0.003653325086093914, "time_weighted_bid_fee": 0.003880972831300226}, "d08": {"arb_edge": -149.7083177453978, "arb_flow_share": 0.2948997372881786, "arb_loss_share": 0.18803853740860144, "arb_loss_to_retail_gain": 0.23158554447703833, "arb_to_retail_volume_ratio": 0.4182380193052146, "arb_trade_count": 3158.3333333333335, "benchmark_mean_edge": 433.80729426835114, "edge_stddev": 3.3063242592128286, "max_edge": 500.1105295605183, "max_fee_jump": 0.037744485353358316, "mean_edge": 496.7410022389998, "mean_edge_delta": 62.9337079706487, "min_edge": 492.2486801402478, "retail_edge": 646.4493199843972, "retail_flow_share": 0.7051002627118214, "retail_gain_share": 0.8119614625913986, "retail_trade_count": 6979.0, "retail_volume_share": 0.4414719277115012, "simulation_count": 3, "time_weighted_ask_fee": 0.0038972105475848346, "time_weighted_bid_fee": 0.003763878863055025}, "d09": {"arb_edge": -148.95064959687195, "arb_flow_share": 0.30392131328778105, "arb_loss_share": 0.1784191102170895, "arb_loss_to_retail_gain": 0.21716560406393323, "arb_to_retail_volume_ratio": 0.4366191913205809, "arb_trade_count": 3462.6666666666665, "benchmark_mean_edge": 472.7253067840316, "edge_stddev": 1.2299810784836924, "max_edge": 538.6085481642161, "max_fee_jump": 0.025963841629706535, "mean_edge": 536.9344390611874, "mean_edge_delta": 64.20913227715583, "min_edge": 535.6883622443754, "retail_edge": 685.8850886580598, "retail_flow_share": 0.696078686712219, "retail_gain_share": 0.8215808897829106, "retail_trade_count": 7365.666666666667, "retail_volume_share": 0.4472357554884218, "simulation_count": 3, "time_weighted_ask_fee": 0.003755779517958928, "time_weighted_bid_fee": 0.0038066731381127474}, "d10": {"arb_edge": -170.91066300046248, "arb_flow_share": 0.3010190731868928, "arb_loss_share": 0.19006948649946828, "arb_loss_to_retail_gain": 0.2346738187180838, "arb_to_retail_volume_ratio": 0.43065420190983117, "arb_trade_count": 3404.0, "benchmark_mean_edge": 481.6015533235047, "edge_stddev": 13.684020666210063, "max_edge": 576.6544789715836, "max_fee_jump": 0.030761746607862697, "mean_edge": 557.3796249152037, "mean_edge_delta": 75.77807159169907, "min_edge": 546.2459916115156, "retail_edge": 728.2902879156678, "retail_flow_share": 0.6989809268131072, "retail_gain_share": 0.8099305135005317, "retail_trade_count": 7628.0, "retail_volume_share": 0.44798002874811826, "simulation_count": 3, "time_weighted_ask_fee": 0.00376320814077657, "time_weighted_bid_fee": 0.003793165525125828}}, "retail_intensity_terciles": {"high": {"arb_edge": -142.4725580559844, "arb_flow_share": 0.299673781954498, "arb_loss_share": 0.17692224844423832, "arb_loss_to_retail_gain": 0.21495204810216795, "arb_to_retail_volume_ratio": 0.42790598757082005, "arb_trade_count": 3377.3, "benchmark_mean_edge": 465.5334862912373, "edge_stddev": 36.63830067579513, "max_edge": 576.6544789715836, "max_fee_jump": 0.024428452066324106, "mean_edge": 520.3383307626523, "mean_edge_delta": 54.80484447141505, "min_edge": 458.6033266960158, "retail_edge": 662.8108888186372, "retail_flow_share": 0.700326218045502, "retail_gain_share": 0.8230777515557616, "retail_trade_count": 7417.1, "retail_volume_share": 0.4454041148472961, "simulation_count": 10, "time_weighted_ask_fee": 0.0037509378600420274, "time_weighted_bid_fee": 0.0038021296949374028}, "low": {"arb_edge": -103.14634263649818, "arb_flow_share": 0.31627575963014093, "arb_loss_share": 0.17862071692932685, "arb_loss_to_retail_gain": 0.21746435612737258, "arb_to_retail_volume_ratio": 0.46257795315118905, "arb_trade_count": 2921.4545454545455, "benchmark_mean_edge": 339.5471937960083, "edge_stddev": 28.722362243502737, "max_edge": 414.89627990134596, "max_fee_jump": 0.026311436860720995, "mean_edge": 371.16744594632405, "mean_edge_delta": 31.620252150315753, "min_edge": 310.16790821615655, "retail_edge": 474.31378858282227, "retail_flow_share": 0.683724240369859, "retail_gain_share": 0.8213792830706731, "retail_trade_count": 5186.0, "retail_volume_share": 0.43415428851469706, "simulation_count": 11, "time_weighted_ask_fee": 0.0038877851358208437, "time_weighted_bid_fee": 0.0038995892788925217}, "mid": {"arb_edge": -116.53389627103091, "arb_flow_share": 0.3092742183182809, "arb_loss_share": 0.17865427992163538, "arb_loss_to_retail_gain": 0.21751410588051762, "arb_to_retail_volume_ratio": 0.44775253294482054, "arb_trade_count": 3101.181818181818, "benchmark_mean_edge": 382.07638291908444, "edge_stddev": 33.6526003654593, "max_edge": 492.2486801402478, "max_fee_jump": 0.026013479008158792, "mean_edge": 419.2193864840838, "mean_edge_delta": 37.14300356499944, "min_edge": 369.928043513796, "retail_edge": 535.7532827551147, "retail_flow_share": 0.6907257816817192, "retail_gain_share": 0.8213457200783646, "retail_trade_count": 5993.272727272727, "retail_volume_share": 0.43769038708095653, "simulation_count": 11, "time_weighted_ask_fee": 0.0038617099852682, "time_weighted_bid_fee": 0.0038461513499340127}}, "volatility_terciles": {"high": {"arb_edge": -118.95127168885669, "arb_flow_share": 0.3102848213403929, "arb_loss_share": 0.1776603907897308, "arb_loss_to_retail_gain": 0.21604260429623023, "arb_to_retail_volume_ratio": 0.44987384784455614, "arb_trade_count": 3148.6, "benchmark_mean_edge": 393.2695935168987, "edge_stddev": 65.75183049255942, "max_edge": 549.2384041625121, "max_fee_jump": 0.026519133114481463, "mean_edge": 431.6404603278277, "mean_edge_delta": 38.370866810928995, "min_edge": 345.27768290338304, "retail_edge": 550.5917320166849, "retail_flow_share": 0.6897151786596071, "retail_gain_share": 0.8223396092102693, "retail_trade_count": 6096.8, "retail_volume_share": 0.43797767979474794, "simulation_count": 10, "time_weighted_ask_fee": 0.003863694352762902, "time_weighted_bid_fee": 0.0038854074925956062}, "low": {"arb_edge": -113.94154598628676, "arb_flow_share": 0.3067615244272048, "arb_loss_share": 0.1771893481413077, "arb_loss_to_retail_gain": 0.2153464442165946, "arb_to_retail_volume_ratio": 0.44250504730531576, "arb_trade_count": 3046.7272727272725, "benchmark_mean_edge": 376.2934978642974, "edge_stddev": 59.59404649252687, "max_edge": 500.1105295605183, "max_fee_jump": 0.025578895085346408, "mean_edge": 415.1665449357291, "mean_edge_delta": 38.87304707143168, "min_edge": 310.16790821615655, "retail_edge": 529.1080909220159, "retail_flow_share": 0.6932384755727953, "retail_gain_share": 0.8228106518586923, "retail_trade_count": 5963.454545454545, "retail_volume_share": 0.4395692034046919, "simulation_count": 11, "time_weighted_ask_fee": 0.0038488873705610684, "time_weighted_bid_fee": 0.0038075511576076376}, "mid": {"arb_edge": -127.12168052772205, "arb_flow_share": 0.30638181234702033, "arb_loss_share": 0.17901989145604966, "arb_loss_to_retail_gain": 0.21805630805544182, "arb_to_retail_volume_ratio": 0.4417153670432652, "arb_trade_count": 3183.818181818182, "benchmark_mean_edge": 411.0245268274667, "edge_stddev": 76.16907510499821, "max_edge": 576.6544789715836, "max_fee_jump": 0.024845401648844877, "mean_edge": 455.8547151627012, "mean_edge_delta": 44.83018833523447, "min_edge": 353.14973961097104, "retail_edge": 582.9763956904231, "retail_flow_share": 0.6936181876529798, "retail_gain_share": 0.8209801085439502, "retail_trade_count": 6416.090909090909, "retail_volume_share": 0.4408748369133192, "simulation_count": 11, "time_weighted_ask_fee": 0.0037981018480544517, "time_weighted_bid_fee": 0.0038624823824387113}}}, "gate": {"failures": [], "passed": true, "required_metric_fields": ["mean_edge"], "stage": "screen", "thresholds": {"mean_edge": 0.0}}, "overall": {"arb_edge": -120.03775651695824, "arb_flow_share": 0.30772375088114534, "arb_loss_share": 0.1779980741311821, "arb_loss_to_retail_gain": 0.21654216192139256, "arb_to_retail_volume_ratio": 0.44451005111445513, "arb_trade_count": 3125.6875, "benchmark_mean_edge": 393.5373189618248, "edge_stddev": 69.67028803300772, "max_edge": 576.6544789715836, "max_fee_jump": 0.02562058110065371, "mean_edge": 434.3012020112816, "mean_edge_delta": 40.763883049456794, "min_edge": 310.16790821615655, "retail_edge": 554.3389585282399, "retail_flow_share": 0.6922762491188547, "retail_gain_share": 0.8220019258688179, "retail_trade_count": 6160.71875, "retail_volume_share": 0.43954195860847356, "simulation_count": 32, "time_weighted_ask_fee": 0.0038360570291374923, "time_weighted_bid_fee": 0.0038507638708270594}, "run_metadata": {"seed_block": [0, 1, 2, 3, 4, 5, 6, 7, 8, 9, 10, 11, 12, 13, 14, 15, 16, 17, 18, 19, 20, 21, 22, 23, 24, 25, 26, 27, 28, 29, 30, 31], "seeds": [0, 1, 2, 3, 4, 5, 6, 7, 8, 9, 10, 11, 12, 13, 14, 15, 16, 17, 18, 19, 20, 21, 22, 23, 24, 25, 26, 27, 28, 29, 30, 31], "simulation_count": 32, "stage": "screen", "telemetry_version": "1.1"}, "scorecard_version": "1.2"}, "selection": {"promotion_margin": null, "rationale": "no incumbent for this stage"}, "snapshot_path": "artifacts/hill_climb/apr08-screen430-1654/snapshots/8af1aa3d1ecb65a442be50cf347044f2be9212eb9bde2e28a757846580bb1de4.sol", "snapshot_relpath": "snapshots/8af1aa3d1ecb65a442be50cf347044f2be9212eb9bde2e28a757846580bb1de4.sol", "source_path": "/Users/victorqian/Desktop/opt_arena/simple_amm/contracts/src/Strategy.sol", "source_sha256": "8af1aa3d1ecb65a442be50cf347044f2be9212eb9bde2e28a757846580bb1de4", "stage": "screen", "stage_description": "Fast mean-edge screening on canonical screening seeds.", "status": "seed", "strategy_name": "LatentStateQuoteEngine"}, "label": "threshold-calm-step-v1", "mean_edge": 434.26831363512036, "parent_eval_id": "screen_0001", "parent_source_sha256": "8af1aa3d1ecb65a442be50cf347044f2be9212eb9bde2e28a757846580bb1de4", "replay_reason": null, "research_refs": ["docs/plans/active/apr08-screen430-1654-cont1.md", "https://app.uniswap.org/whitepaper-v4.pdf", "https://www.math.columbia.edu/~mnutz/docs/AMM_fees.pdf", "https://arxiv.org/abs/2508.08152"], "run_id": "apr08-screen430-1654", "scorecard": {"by_slice": {"mean_edge_deciles": {"d01": {"arb_edge": -80.52169396442808, "arb_flow_share": 0.3142094397150867, "arb_loss_share": 0.16057358065625296, "arb_loss_to_retail_gain": 0.1912896436852528, "arb_to_retail_volume_ratio": 0.45817113549149413, "arb_trade_count": 2881.25, "benchmark_mean_edge": 328.39534649565167, "edge_stddev": 17.75755777744658, "max_edge": 353.13288842828604, "max_fee_jump": 0.019380512110409837, "mean_edge": 340.4195154662203, "mean_edge_delta": 12.024168970568581, "min_edge": 310.168410083301, "retail_edge": 420.94120943064826, "retail_flow_share": 0.6857905602849133, "retail_gain_share": 0.839426419343747, "retail_trade_count": 5001.25, "retail_volume_share": 0.42784993303974506, "simulation_count": 4, "time_weighted_ask_fee": 0.003929870213793235, "time_weighted_bid_fee": 0.004002072036181991}, "d02": {"arb_edge": -99.65609316255056, "arb_flow_share": 0.3111639041117916, "arb_loss_share": 0.17560786036800718, "arb_loss_to_retail_gain": 0.21301496208636608, "arb_to_retail_volume_ratio": 0.4517241561079439, "arb_trade_count": 2946.0, "benchmark_mean_edge": 338.9129846595408, "edge_stddev": 3.056166101970683, "max_edge": 370.644198590807, "max_fee_jump": 0.025681170104087724, "mean_edge": 368.1800258897131, "mean_edge_delta": 29.26704123017227, "min_edge": 363.87285961522275, "retail_edge": 467.8361190522635, "retail_flow_share": 0.6888360958882084, "retail_gain_share": 0.8243921396319929, "retail_trade_count": 5449.333333333333, "retail_volume_share": 0.43899198631423003, "simulation_count": 3, "time_weighted_ask_fee": 0.003863265345873433, "time_weighted_bid_fee": 0.0037941632796401428}, "d03": {"arb_edge": -98.86653589712394, "arb_flow_share": 0.31297181633062987, "arb_loss_share": 0.1698284144729774, "arb_loss_to_retail_gain": 0.20457025684053526, "arb_to_retail_volume_ratio": 0.45554436305519375, "arb_trade_count": 3003.3333333333335, "benchmark_mean_edge": 361.66741706629654, "edge_stddev": 2.9844275090305814, "max_edge": 387.63921380538534, "max_fee_jump": 0.017777581201908144, "mean_edge": 384.42237141549384, "mean_edge_delta": 22.754954349197344, "min_edge": 380.447696828805, "retail_edge": 483.28890731261816, "retail_flow_share": 0.6870281836693701, "retail_gain_share": 0.8301715855270226, "retail_trade_count": 5578.0, "retail_volume_share": 0.43628367824258935, "simulation_count": 3, "time_weighted_ask_fee": 0.003856918590616342, "time_weighted_bid_fee": 0.00385158042220333}, "d04": {"arb_edge": -109.74762544276415, "arb_flow_share": 0.3107690820684895, "arb_loss_share": 0.17856746893999537, "arb_loss_to_retail_gain": 0.217385436037657, "arb_to_retail_volume_ratio": 0.450892544114469, "arb_trade_count": 2969.3333333333335, "benchmark_mean_edge": 360.6730721948555, "edge_stddev": 2.5038093647142863, "max_edge": 396.92595483079094, "max_fee_jump": 0.026820905862611752, "mean_edge": 395.1050797023631, "mean_edge_delta": 34.43200750750765, "min_edge": 391.5646416957061, "retail_edge": 504.8527051451271, "retail_flow_share": 0.6892309179315105, "retail_gain_share": 0.8214325310600047, "retail_trade_count": 5569.666666666667, "retail_volume_share": 0.4369476215120279, "simulation_count": 3, "time_weighted_ask_fee": 0.0038360216371760643, "time_weighted_bid_fee": 0.003892814149979202}, "d05": {"arb_edge": -127.04552957710065, "arb_flow_share": 0.3198036094540281, "arb_loss_share": 0.192071812228475, "arb_loss_to_retail_gain": 0.23773376784669284, "arb_to_retail_volume_ratio": 0.47016363788307064, "arb_trade_count": 3025.0, "benchmark_mean_edge": 357.4482506820178, "edge_stddev": 5.643610504785247, "max_edge": 414.8495227080402, "max_fee_jump": 0.0340333403752692, "mean_edge": 407.35701124759333, "mean_edge_delta": 49.908760565575484, "min_edge": 401.22911463220527, "retail_edge": 534.4025408246943, "retail_flow_share": 0.680196390545972, "retail_gain_share": 0.8079281877715251, "retail_trade_count": 5453.666666666667, "retail_volume_share": 0.4360230286619506, "simulation_count": 3, "time_weighted_ask_fee": 0.0038261018296033705, "time_weighted_bid_fee": 0.0038637755302522504}, "d06": {"arb_edge": -120.87822636644024, "arb_flow_share": 0.3122387456273634, "arb_loss_share": 0.1799591595940379, "arb_loss_to_retail_gain": 0.21945145988698433, "arb_to_retail_volume_ratio": 0.4539929279851363, "arb_trade_count": 3193.0, "benchmark_mean_edge": 390.5173574796861, "edge_stddev": 3.47082440608131, "max_edge": 433.9674472442351, "max_fee_jump": 0.02302338952556547, "mean_edge": 429.94165165438307, "mean_edge_delta": 39.42429417469698, "min_edge": 424.5443193913432, "retail_edge": 550.819878020823, "retail_flow_share": 0.6877612543726366, "retail_gain_share": 0.8200408404059621, "retail_trade_count": 6101.5, "retail_volume_share": 0.4381496915754355, "simulation_count": 4, "time_weighted_ask_fee": 0.003918083431864721, "time_weighted_bid_fee": 0.0038133039010231663}, "d07": {"arb_edge": -107.2541861809879, "arb_flow_share": 0.3012603210192539, "arb_loss_share": 0.15925719628172966, "arb_loss_to_retail_gain": 0.18942439421116486, "arb_to_retail_volume_ratio": 0.4311481515672665, "arb_trade_count": 3271.0, "benchmark_mean_edge": 432.1118921847362, "edge_stddev": 3.8691595045766034, "max_edge": 463.8624722429522, "max_fee_jump": 0.017961843038962824, "mean_edge": 458.9568693044219, "mean_edge_delta": 26.844977119685705, "min_edge": 454.4048089742977, "retail_edge": 566.2110554854092, "retail_flow_share": 0.6987396789807462, "retail_gain_share": 0.8407428037182704, "retail_trade_count": 6894.3333333333